{
  "contract_version": "1.0.0",
  "status": "frozen",
  "api_base": "/api/v1/oneshot",
  "resources": {
    "Task": {
      "id_prefix": "otk_",
      "description": "User-visible unit of One-shot work. A Task may contain multiple immutable Runs.",
      "fields": [
        {
          "name": "id",
          "type": "string",
          "required": true,
          "immutable": true,
          "description": "Stable OpenDray Task identifier."
        },
        {
          "name": "principal_kind",
          "type": "enum",
          "required": true,
          "immutable": true,
          "description": "Authenticated owner kind.",
          "enum": [
            "admin",
            "integration"
          ]
        },
        {
          "name": "principal_id",
          "type": "string",
          "required": true,
          "immutable": true,
          "description": "Authenticated owner identifier."
        },
        {
          "name": "project_id",
          "type": "string",
          "required": true,
          "immutable": true,
          "description": "Registered project/workspace owner."
        },
        {
          "name": "provider_id",
          "type": "string",
          "required": true,
          "immutable": true,
          "description": "Requested One-shot provider adapter."
        },
        {
          "name": "model",
          "type": "string",
          "required": true,
          "immutable": true,
          "description": "Requested model identifier for the provider adapter."
        },
        {
          "name": "source",
          "type": "object",
          "required": true,
          "immutable": true,
          "description": "Origin snapshot: api, telegram, mobile or web and channel address metadata."
        },
        {
          "name": "prompt",
          "type": "string",
          "required": true,
          "immutable": true,
          "description": "Original requested work. Follow-up input belongs to the new Delivery/Run."
        },
        {
          "name": "status",
          "type": "enum",
          "required": true,
          "immutable": false,
          "description": "Current aggregate status.",
          "enum": [
            "pending",
            "queued",
            "running",
            "waiting_input",
            "completed",
            "failed",
            "cancelled",
            "timed_out"
          ]
        },
        {
          "name": "current_run_id",
          "type": "nullable_string",
          "required": false,
          "immutable": false,
          "description": "Latest/current Run identifier."
        },
        {
          "name": "runtime_context_id",
          "type": "nullable_string",
          "required": false,
          "immutable": false,
          "description": "Provider continuity metadata; never a PTY Session ID."
        },
        {
          "name": "version",
          "type": "integer",
          "required": true,
          "immutable": false,
          "description": "Optimistic concurrency version, starts at 1."
        },
        {
          "name": "created_at",
          "type": "timestamp",
          "required": true,
          "immutable": true,
          "description": ""
        },
        {
          "name": "updated_at",
          "type": "timestamp",
          "required": true,
          "immutable": false,
          "description": ""
        }
      ],
      "invariants": [
        "principal_kind, principal_id, project_id, provider_id, source and original prompt are immutable",
        "at most one Run for the Task may be active",
        "current_run_id, when present, references a Run owned by the same Task",
        "runtime_context_id, when present, references a RuntimeContext with the same principal, project and provider",
        "Task outcome transitions never rewrite an earlier Run; continue and retry create a new Delivery and Run",
        "cancelled is terminal; a new Task is required to execute again"
      ]
    },
    "Delivery": {
      "id_prefix": "odl_",
      "description": "Reliable request to start or resume one Run. Channel delivery is a separate concept.",
      "fields": [
        {
          "name": "id",
          "type": "string",
          "required": true,
          "immutable": true,
          "description": ""
        },
        {
          "name": "task_id",
          "type": "string",
          "required": true,
          "immutable": true,
          "description": ""
        },
        {
          "name": "operation",
          "type": "enum",
          "required": true,
          "immutable": true,
          "description": "",
          "enum": [
            "new",
            "continue",
            "retry"
          ]
        },
        {
          "name": "requested_by_kind",
          "type": "enum",
          "required": true,
          "immutable": true,
          "description": "",
          "enum": [
            "admin",
            "integration"
          ]
        },
        {
          "name": "requested_by_id",
          "type": "string",
          "required": true,
          "immutable": true,
          "description": ""
        },
        {
          "name": "input",
          "type": "object",
          "required": true,
          "immutable": true,
          "description": "Prompt delta, attachment references and requested options."
        },
        {
          "name": "idempotency_key",
          "type": "string",
          "required": true,
          "immutable": true,
          "description": ""
        },
        {
          "name": "payload_sha256",
          "type": "string",
          "required": true,
          "immutable": true,
          "description": ""
        },
        {
          "name": "status",
          "type": "enum",
          "required": true,
          "immutable": false,
          "description": "",
          "enum": [
            "pending",
            "reserved",
            "retry_wait",
            "acknowledged",
            "dead_letter",
            "cancelled"
          ]
        },
        {
          "name": "attempt",
          "type": "integer",
          "required": true,
          "immutable": false,
          "description": ""
        },
        {
          "name": "max_attempts",
          "type": "integer",
          "required": true,
          "immutable": true,
          "description": ""
        },
        {
          "name": "available_at",
          "type": "timestamp",
          "required": true,
          "immutable": false,
          "description": ""
        },
        {
          "name": "lease_owner",
          "type": "nullable_string",
          "required": false,
          "immutable": false,
          "description": ""
        },
        {
          "name": "lease_until",
          "type": "nullable_timestamp",
          "required": false,
          "immutable": false,
          "description": ""
        },
        {
          "name": "run_id",
          "type": "nullable_string",
          "required": false,
          "immutable": false,
          "description": ""
        },
        {
          "name": "last_error_code",
          "type": "nullable_string",
          "required": false,
          "immutable": false,
          "description": ""
        },
        {
          "name": "created_at",
          "type": "timestamp",
          "required": true,
          "immutable": true,
          "description": ""
        },
        {
          "name": "updated_at",
          "type": "timestamp",
          "required": true,
          "immutable": false,
          "description": ""
        }
      ],
      "invariants": [
        "one Delivery creates at most one Run and run_id is immutable once assigned",
        "a reserved Delivery has a non-empty lease_owner and future lease_until",
        "acknowledged, dead_letter and cancelled are terminal",
        "notification retry never creates or mutates a Delivery",
        "the same principal and idempotency key with the same payload returns the original result"
      ]
    },
    "Run": {
      "id_prefix": "orn_",
      "description": "One immutable ordinary child-process execution attempt.",
      "fields": [
        {
          "name": "id",
          "type": "string",
          "required": true,
          "immutable": true,
          "description": ""
        },
        {
          "name": "task_id",
          "type": "string",
          "required": true,
          "immutable": true,
          "description": ""
        },
        {
          "name": "delivery_id",
          "type": "string",
          "required": true,
          "immutable": true,
          "description": ""
        },
        {
          "name": "provider_id",
          "type": "string",
          "required": true,
          "immutable": true,
          "description": ""
        },
        {
          "name": "model",
          "type": "string",
          "required": true,
          "immutable": true,
          "description": "Model identifier used for this execution."
        },
        {
          "name": "runtime_context_id",
          "type": "nullable_string",
          "required": false,
          "immutable": true,
          "description": ""
        },
        {
          "name": "status",
          "type": "enum",
          "required": true,
          "immutable": false,
          "description": "",
          "enum": [
            "created",
            "starting",
            "running",
            "collecting_output",
            "waiting_input",
            "completed",
            "failed",
            "cancelled",
            "timed_out"
          ]
        },
        {
          "name": "pid",
          "type": "nullable_integer",
          "required": false,
          "immutable": false,
          "description": ""
        },
        {
          "name": "exit_code",
          "type": "nullable_integer",
          "required": false,